{
  "id": "758258bc-ecc1-41b8-abca-f7b610822ffd",
  "name": "ORWIG ETHNO CD",
  "code": "KU/CC/DI/O",
  "isActive": true,
  "institutionId": "40ee00ca-a518-4b49-be01-0638d0a4ac57",
  "campusId": "62cf76b7-cca5-4d33-9217-edf42ce1a848",
  "libraryId": "5d78803e-ca04-4b4a-aeae-2c63b924518b",
  "primaryServicePoint": "3a40852d-49fd-4df2-a1f9-6e2641a6e91f",
  "servicePointIds": [ "3a40852d-49fd-4df2-a1f9-6e2641a6e91f" ]
}
